{
  "schemaId": "xw.orchestration.skill-catalog.v1",
  "schemaVersion": 1,
  "catalogId": "m5-readonly-v1",
  "registrations": [
    {
      "skillSpec": {
        "schemaId": "xw.skill.spec.v1",
        "schemaVersion": 1,
        "skillId": "xhs.observe.feed",
        "version": "0.1.0",
        "implementationMode": "scripted",
        "sourcePath": "services/orchestrator/skills/xhs/xhs-observe-feed/SKILL.md",
        "sourceCommit": "db8885eb00b50ba80677cebd865e4765e3d7929e",
        "sourceBlobSha": "65a71251aa1c4e9cc8712f0e48237183c05c1a48",
        "inputSchema": { "type": "object", "additionalProperties": false },
        "outputSchema": { "type": "object" },
        "preconditions": ["formal-job-or-session", "visible-lease", "xhs-feed-ready"],
        "requiredCapabilities": ["xhs.observe.feed"],
        "states": ["READY", "RUNNING", "VERIFYING", "BLOCKED", "SUCCEEDED", "FAILED", "CANCELLED"],
        "exits": ["COMPLETED", "RETRY", "REPAIR_REQUIRED", "ABORTED"],
        "verifiers": [{ "id": "xhs-feed-business-output", "mode": "typed-job-worker" }]
      },
      "skillVersionRef": {
        "skillId": "xhs.observe.feed",
        "skillVersion": "0.1.0",
        "skillSpecSha256": "3f851a543544d046939d03b391fe7dcdf6e210612b3a68ea27837e5387254d58",
        "sourceCommit": "db8885eb00b50ba80677cebd865e4765e3d7929e",
        "sourcePath": "services/orchestrator/skills/xhs/xhs-observe-feed/SKILL.md",
        "sourceBlobSha": "65a71251aa1c4e9cc8712f0e48237183c05c1a48"
      },
      "roles": ["collect"],
      "localValidator": false,
      "executor": { "kind": "capability", "capabilityId": "xhs.observe.feed" },
      "effectContract": { "class": "none", "source": "capability-contract" }
    },
    {
      "skillSpec": {
        "schemaId": "xw.skill.spec.v1",
        "schemaVersion": 1,
        "skillId": "xw.validate.business-output",
        "version": "1.0.0",
        "implementationMode": "scripted",
        "sourcePath": "services/orchestrator/scripts/lib/typed-job-worker.mjs",
        "sourceCommit": "db8885eb00b50ba80677cebd865e4765e3d7929e",
        "sourceBlobSha": "98e56f1e6cc76db83f8c04ef741fea48c7554fd3",
        "inputSchema": { "type": "object" },
        "outputSchema": { "type": "object" },
        "preconditions": ["upstream-results-terminal"],
        "requiredCapabilities": [],
        "states": ["READY", "RUNNING", "VERIFYING", "BLOCKED", "SUCCEEDED", "FAILED", "CANCELLED"],
        "exits": ["COMPLETED", "RETRY", "REPAIR_REQUIRED", "ABORTED"],
        "verifiers": [{ "id": "business-output-contract", "exportName": "validateBusinessOutput" }]
      },
      "skillVersionRef": {
        "skillId": "xw.validate.business-output",
        "skillVersion": "1.0.0",
        "skillSpecSha256": "3b89ef54663599e0fcfe3052fdc32eec6c8bd2f22e9ef5e10d8fbb17d2d918bf",
        "sourceCommit": "db8885eb00b50ba80677cebd865e4765e3d7929e",
        "sourcePath": "services/orchestrator/scripts/lib/typed-job-worker.mjs",
        "sourceBlobSha": "98e56f1e6cc76db83f8c04ef741fea48c7554fd3"
      },
      "roles": ["validate"],
      "localValidator": true,
      "executor": {
        "kind": "local",
        "module": "services/orchestrator/scripts/lib/typed-job-worker.mjs",
        "exportName": "validateBusinessOutput"
      },
      "effectContract": { "class": "none", "source": "local-validator" }
    }
  ]
}
